title,url,timestamp
"Elliot , 16 , tog studenten som åttaåring",https://www.st.nu/2025-01-07/elliot-16-tog-studenten-som-attaaring/,
"Il genio del giorno , il tipo che ha vinto 500mila dollari alla lotteria giocando i numeri della targa di una macchina che gli aveva tagliato la strada",https://www.blitzquotidiano.it/cronaca/il-genio-del-giorno-il-tipo-che-ha-vinto-500mila-dollari-alla-lotteria-giocando-i-numeri-della-targa-di-una-macchina-che-gli-aveva-tagliato-la-strada-3679585/,
"  LO QUE LE PASÓ A HAWAii  Lyrics & English Translation : See the Meaning of Bad Bunny New Song | Bad Bunny , Music | Just Jared : Celebrity Gossip and Breaking Entertainment News",https://www.justjared.com/2025/01/07/lo-que-le-paso-a-hawaii-lyrics-english-translation-see-the-meaning-of-bad-bunnys-new-song/,
"  മന്ത്രിയുടെ വാക്കുകള്‍ വമിപ്പിക്കുന്നത് വിഷപ്പുക ; സജി ചെറിയാനെതിരെ രൂക്ഷവിമര്‍ശനവുമായി  ദീപിക , സജി ചെറിയാൻ , ദീപിക , കത്തോലിക്കാസഭ , deepika , saji cheriyan , u prathibha , smoking , latest malayalam news , news",https://www.mathrubhumi.com/news/kerala/deepika-editorial-against-minister-saji-cheriyan-on-prathibha-mla-son-case-1.10231436,
Magdalena e il giovane Mozart con il celebre organo Bonatti,https://www.larena.it/argomenti/spettacoli/appuntamenti/magdalena-e-il-giovane-mozart-con-il-celebre-organo-bonatti-1.12546034,
